{
  "schema_version": "ISRAS-GITHUB-CONTROL-EVIDENCE-V1",
  "repository": "Iron-Signal-Systems/example",
  "source_commit": "1111111111111111111111111111111111111111",
  "commit_tree_sha": "2222222222222222222222222222222222222222",
  "default_branch": "dev",
  "collected_at": "2026-07-16T00:00:00Z",
  "collector": {
    "tool": "gh",
    "version": "gh version example",
    "actor": "example"
  },
  "raw_configuration_sha512": "33333333333333333333333333333333333333333333333333333333333333333333333333333333333333333333333333333333333333333333333333333333",
  "rulesets": [],
  "branch_protection": {
    "dev": {
      "status": "NOT_CONFIGURED"
    },
    "main": {
      "status": "NOT_CONFIGURED"
    }
  }
}
